{
  "schema_version": "2.0",
  "style_id": "product-report",
  "display_name": "Product Report",
  "description": "Product strategy, metrics, roadmap, and tradeoff slides.",
  "audience": ["product_lead", "operator"],
  "formality": "executive",
  "presentation_context": ["live", "review"],
  "aspect_ratios": ["16:9"],
  "colors": {
    "primary": "#232030",
    "accent": "#6B5B95",
    "background": "#F6F5F2",
    "surface_1": "#EDEBE6",
    "surface_2": "#E3DFD6",
    "text_primary": "#2A2E35",
    "text_secondary": "#7A746B",
    "border": "#E3DFD6",
    "positive": "#4E7358",
    "warning": "#A66A2C",
    "negative": "#9C4A48",
    "data_series": ["#232030", "#6B5B95", "#4E7358", "#A66A2C"],
    "allowed_opacity": [0.08, 0.12, 0.18, 0.45, 1]
  },
  "typography": {
    "font_primary": ["Aptos", "Noto Sans CJK SC", "Microsoft YaHei", "sans-serif"],
    "font_editorial": ["Source Han Serif SC", "Noto Serif CJK SC", "SimSun", "serif"],
    "font_mono": ["JetBrains Mono", "Consolas", "monospace"],
    "title_sizes_pt": {"cover": 34, "section": 28, "slide": 22},
    "body_sizes_pt": {"large": 16, "normal": 13, "small": 10, "footnote": 8.5},
    "metric_sizes_pt": {"hero": 30, "normal": 22},
    "minimum_body_size_pt": 10,
    "minimum_footnote_size_pt": 8,
    "line_height": {"cover_title": 1.05, "slide_title": 1.1, "body": 1.35, "caption": 1.25},
    "paragraph_spacing_pt": {"body": 6, "list": 4},
    "letter_spacing_pt": {"cover_title": 0, "uppercase_label": 0.8},
    "weights": {"regular": 400, "medium": 500, "semibold": 600, "bold": 700}
  },
  "grid": {"columns": 12, "rows": 8, "margin_left_in": 0.55, "margin_right_in": 0.55, "margin_top_in": 0.38, "margin_bottom_in": 0.35, "gutter_horizontal_in": 0.14, "gutter_vertical_in": 0.12, "title_zone_height_in": 0.72, "footer_zone_height_in": 0.24, "safe_zone_in": {"left": 0.08, "right": 0.08, "top": 0.06, "bottom": 0.06}},
  "spacing": {"unit": "in", "scale": {"xs": 0.06, "sm": 0.1, "md": 0.16, "lg": 0.24, "xl": 0.36, "xxl": 0.52}, "rules": {"title_to_body": "lg", "card_gap": "md", "section_gap": "xl", "icon_to_label": "sm", "label_to_value": "xs", "paragraph_gap": "sm"}},
  "shape_tokens": {"card_radius_pt": 8, "small_radius_pt": 4, "pill_radius_pt": 999, "border_width_pt": 0.8, "emphasis_border_width_pt": 1.5, "connector_width_pt": 1.2, "primary_connector_width_pt": 2.2, "divider_width_pt": 0.6},
  "shadow_tokens": {"default": {"enabled": false}, "floating_panel": {"enabled": true, "opacity": 0.12, "blur_pt": 4, "distance_pt": 2, "angle_deg": 90}},
  "card_tokens": {"default": {"fill": "surface_1", "text_color": "text_primary", "border_color": "border", "border_width_ref": "shape_tokens.border_width_pt", "radius_ref": "shape_tokens.card_radius_pt", "padding": {"horizontal": "md", "vertical": "md"}, "shadow_ref": "shadow_tokens.default"}, "highlight": {"fill": "primary", "text_color": "background", "border_color": "primary"}, "metric": {"fill": "background", "number_color": "primary", "label_color": "text_secondary", "trend_positive_color": "positive", "trend_negative_color": "negative"}, "risk": {"fill": "surface_1", "border_color": "warning", "icon_color": "warning"}, "quote": {"fill": "surface_1", "text_color": "text_primary", "border_color": "accent"}, "comparison": {"fill": "background", "text_color": "text_primary", "border_color": "border"}, "source": {"fill": "surface_2", "text_color": "text_secondary", "border_color": "border"}},
  "table_tokens": {"default": {"header_fill": "primary", "header_text": "background", "body_fill": "background", "alternate_row_fill": "surface_1", "text_color": "text_primary", "border_color": "border", "border_width_pt": 0.5, "cell_padding_in": {"horizontal": 0.08, "vertical": 0.06}, "header_font_weight": 600, "body_font_size_ref": "typography.body_sizes_pt.small"}, "matrix": {"row_header_fill": "surface_2", "column_header_fill": "primary", "highlight_fill": "accent", "highlight_text": "background"}, "minimal": {"show_vertical_borders": false, "show_outer_border": false, "show_horizontal_dividers": true}},
  "chart_tokens": {"series_colors": ["primary", "accent", "positive", "text_secondary", "warning"], "axis_color": "border", "axis_label_color": "text_secondary", "gridline_color": "surface_2", "data_label_color": "text_primary", "highlight_color": "accent", "bar_gap_ratio": 0.35, "line_width_pt": 2, "marker_size_pt": 5, "show_chart_border": false, "show_legend_by_default": false, "show_gridlines_by_default": false, "direct_label_preferred": true, "zero_baseline_required_for_bar": true},
  "diagram_tokens": {"node": {"fill": "surface_1", "text_color": "text_primary", "border_color": "border", "radius_ref": "shape_tokens.card_radius_pt", "padding": "sm"}, "primary_node": {"fill": "primary", "text_color": "background", "border_color": "primary"}, "connector": {"default_color": "text_secondary", "primary_color": "primary", "secondary_opacity": 0.45, "width_ref": "shape_tokens.connector_width_pt", "primary_width_ref": "shape_tokens.primary_connector_width_pt", "arrow_type": "triangle"}, "relation_styles": {"request": "orthogonal", "data_flow": "orthogonal", "feedback": "curved", "optional": "dashed"}},
  "image_tokens": {"default_crop_mode": "cover", "portrait_crop_mode": "contain", "corner_radius_pt": 8, "allow_full_bleed": true, "default_overlay_opacity": 0.18, "caption_position": "bottom", "caption_style_ref": "typography.body_sizes_pt.footnote", "duotone_allowed": false, "grayscale_allowed": true},
  "icon_tokens": {"stroke_width_pt": 1.4, "default_color": "text_secondary", "accent_color": "accent", "allowed_styles": ["outline", "filled-minimal"]},
  "footer_tokens": {"enabled": true, "height_in": 0.24, "text_color": "text_secondary", "font_size_ref": "typography.body_sizes_pt.footnote", "divider_color": "border"},
  "density_limits": {"low": {"max_primary_objects": 2, "max_supporting_objects": 3, "max_body_characters_zh": 80}, "medium": {"max_primary_objects": 4, "max_supporting_objects": 5, "max_body_characters_zh": 180}, "high": {"max_primary_objects": 6, "max_supporting_objects": 8, "max_body_characters_zh": 320}, "presentation_context_overrides": {"live": {"body_character_multiplier": 0.8}, "self_reading": {"body_character_multiplier": 1.3}}},
  "component_variants": {"cover": "consulting-header", "judgment_evidence": "cards.default", "metric": "cards.metric", "table": "table_tokens.default", "chart": "chart_tokens"},
  "allowed_effects": ["subtle_divider", "single_accent_rule", "bounded_material_layer"],
  "forbidden_drift": ["bright saturated gradients", "full-slide raster for ordinary tables", "connector web without main path"],
  "compatibility_aliases": [{"alias": "linear", "maps_to": "product-report"}]
}
